{
  "node_id": "local-lab",
  "host": "127.0.0.1",
  "available_until": "2035-01-01T12:00:00Z",
  "gpu_count": 1,
  "gpus": [
    {
      "index": 0,
      "uuid": "GPU-LOCAL-0001",
      "total_memory_mib": 98304,
      "free_memory_mib": 44000,
      "utilization_pct": 8
    }
  ],
  "cached_models": [
    "qwen3-coder:30b"
  ],
  "labels": {
    "site": "local",
    "role": "developer-workstation"
  },
  "trust_tier": "trusted",
  "network_tier": "lan"
}
